<?xml version="1.0" encoding="utf-8"?>
<xs:schema xmlns:xs="http://www.w3.org/2001/XMLSchema" elementFormDefault="qualified" attributeFormDefault="unqualified">

<xs:element name="Airlines">
  <xs:complexType>
    <xs:sequence>
      <xs:element name="Airline" type="AirlineDetails" minOccurs="1" maxOccurs="unbounded"/>
    </xs:sequence>
  </xs:complexType>
</xs:element>

<xs:complexType name="AirlineDetails">
    <xs:sequence>
        <xs:element name="Airline_id" type="length" maxOccurs="1"/>
        <xs:element name="Airline" type="xs:string" minOccurs="1" maxOccurs="1"/>
    </xs:sequence>
</xs:complexType>


    <xs:simpleType name="length">
        <xs:restriction base="xs:string">
            <xs:whiteSpace value="collapse"/>
            <xs:length value="2"/>
        </xs:restriction>
    </xs:simpleType>



</xs:schema>